{
    "train_$FCModel_16$nfeats": 1000,
    "train_$FCModel_16$cls_type": "LogisticRegression",
    "train_$FCModel_16$param_batch_sz": 80,
    "train_$FCModel_16$C": 0.1,
    "train_$FCModel_16$feature_selection_criterion": "auc",
    "train_$FCModel_16$normalize_for_feature_selection": true,
    "train_$FCModel_16$features": "pnorm_delta",
    "train_$FCModel_16$ntensors": 25,
    "train_$FCModel_16$sort_tensors": true,
    "train_$CNNModel_14$nfeats": 1000,
    "train_$CNNModel_14$cls_type": "LogisticRegression",
    "train_$CNNModel_14$param_batch_sz": 80,
    "train_$CNNModel_14$C": 0.1,
    "train_$CNNModel_14$feature_selection_criterion": "auc",
    "train_$CNNModel_14$normalize_for_feature_selection": true,
    "train_$CNNModel_14$features": "pnorm_delta",
    "train_$CNNModel_14$ntensors": 25,
    "train_$CNNModel_14$sort_tensors": true
}
